{
  "kind": "content_item",
  "schema_version": "1.0.0",
  "content_key": "cnt_prog_cooking_17",
  "tenant_id": "tenant_demo",
  "content_type": "tv_program",
  "source_profile_ref": {
    "id": "prof_acr_viewing_ref",
    "version": "1.0.0"
  },
  "canonical_ref": "library://programs/cooking-17",
  "label": "Weeknight cooking, episode 17",
  "approved_text_ref": "text://programs/cooking-17/synopsis",
  "language": "en",
  "taxonomy_refs": [
    "iab_ct_food_drink"
  ],
  "content_time": "2026-09-12T19:00:00Z",
  "resolution": {
    "method": "Fingerprint library match",
    "quality": 0.97
  },
  "rights_policy_ref": {
    "id": "rights_demo_2026",
    "version": "1.0.0"
  }
}
